Store Name,Address,City,State,ZIP,Phone,Website,Category,Description,Monday Hours,Tuesday Hours,Wednesday Hours,Thursday Hours,Friday Hours,Saturday Hours,Sunday Hours,Service Area,Service Area Type,Hide Address,Labels,Store Code,Special Offers,Payment Methods
"Fly2Any - Agência de Viagens Online NYC","123 Main Street","New York","NY","10001","(555) 123-4567","https://fly2any.com","Travel agency","Agência de viagens especializada na comunidade brasileira. Atendimento em português, inglês e espanhol. Consultas virtuais via WhatsApp e videochamada. Especialistas em voos Brasil-EUA com foco na diáspora brasileira em Nova York.","9:00 AM - 8:00 PM","9:00 AM - 8:00 PM","9:00 AM - 8:00 PM","9:00 AM - 8:00 PM","9:00 AM - 8:00 PM","10:00 AM - 6:00 PM","10:00 AM - 6:00 PM","New York, Queens, Brooklyn, Bronx, Staten Island, Newark, Jersey City, Long Island City, Astoria, Flushing","Service Area Business","Yes","Brazilian Travel, Portuguese Service, Virtual Consultation","FLY2ANY_NYC","Consulta gratuita via WhatsApp. Desconto especial para comunidade brasileira.","Credit Card, PayPal, Pix, Bank Transfer"
"Fly2Any - Agência de Viagens Online Boston","456 Oak Avenue","Boston","MA","02101","(555) 234-5678","https://fly2any.com","Travel agency","Especialistas em viagens para a comunidade brasileira de Boston. Atendimento personalizado em português. Consultas virtuais disponíveis. Conhecimento profundo das necessidades da diáspora brasileira em Framingham, Marlborough e região metropolitana de Boston.","9:00 AM - 8:00 PM","9:00 AM - 8:00 PM","9:00 AM - 8:00 PM","9:00 AM - 8:00 PM","9:00 AM - 8:00 PM","10:00 AM - 6:00 PM","10:00 AM - 6:00 PM","Boston, Framingham, Marlborough, Somerville, Cambridge, Newton, Quincy, Brockton, Lowell, Lawrence","Service Area Business","Yes","Brazilian Travel, Portuguese Service, Virtual Consultation","FLY2ANY_BOS","Primeira consulta gratuita. Parcelamento disponível.","Credit Card, PayPal, Pix, Bank Transfer"
"Fly2Any - Agência de Viagens Online Miami","789 Palm Drive","Miami","FL","33101","(555) 345-6789","https://fly2any.com","Travel agency","Líder em viagens para brasileiros no Sul da Flórida. Serviço trilíngue (português, espanhol, inglês). Especialistas em voos Miami-Brasil e conexões internacionais. Atendimento virtual 7 dias por semana para a comunidade brasileira.","8:00 AM - 9:00 PM","8:00 AM - 9:00 PM","8:00 AM - 9:00 PM","8:00 AM - 9:00 PM","8:00 AM - 9:00 PM","9:00 AM - 7:00 PM","9:00 AM - 7:00 PM","Miami, Brickell, Aventura, Fort Lauderdale, Pompano Beach, Deerfield Beach, Coral Springs, Pembroke Pines, Homestead, Kendall","Service Area Business","Yes","Brazilian Travel, Portuguese Service, Virtual Consultation","FLY2ANY_MIA","Promoções especiais para voos Brasil. Atendimento WhatsApp 24h.","Credit Card, PayPal, Pix, Bank Transfer"
"Fly2Any - Agência de Viagens Online Orlando","321 Disney Boulevard","Orlando","FL","32801","(555) 456-7890","https://fly2any.com","Travel agency","Especialistas em turismo brasileiro em Orlando. Pacotes familiares e individuais. Consultoria virtual especializada em Disney World, Universal Studios e viagens corporativas. Atendimento em português para brasileiros visitando ou morando na região.","8:00 AM - 9:00 PM","8:00 AM - 9:00 PM","8:00 AM - 9:00 PM","8:00 AM - 9:00 PM","8:00 AM - 9:00 PM","9:00 AM - 7:00 PM","9:00 AM - 7:00 PM","Orlando, Kissimmee, Winter Garden, Altamonte Springs, Sanford, Lake Mary, Clermont, Davenport, Champions Gate, Celebration","Service Area Business","Yes","Brazilian Travel, Portuguese Service, Virtual Consultation","FLY2ANY_ORL","Pacotes Disney com desconto. Planejamento gratuito de roteiro.","Credit Card, PayPal, Pix, Bank Transfer"
"Fly2Any - Agência de Viagens Online Atlanta","654 Peach Street","Atlanta","GA","30301","(555) 567-8901","https://fly2any.com","Travel agency","Agência de viagens para a crescente comunidade brasileira de Atlanta. Especialistas em conexões internacionais via hub de Atlanta. Consultas virtuais em português e inglês. Foco em viagens corporativas e familiares Brasil-EUA.","9:00 AM - 8:00 PM","9:00 AM - 8:00 PM","9:00 AM - 8:00 PM","9:00 AM - 8:00 PM","9:00 AM - 8:00 PM","10:00 AM - 6:00 PM","10:00 AM - 6:00 PM","Atlanta, Marietta, Roswell, Sandy Springs, Alpharetta, Duluth, Norcross, Lawrenceville, Decatur, Stone Mountain","Service Area Business","Yes","Brazilian Travel, Portuguese Service, Virtual Consultation","FLY2ANY_ATL","Consulta estratégica gratuita. Especialistas em conexões Atlanta.","Credit Card, PayPal, Pix, Bank Transfer"
"Fly2Any - Agência de Viagens Online Los Angeles","987 Sunset Avenue","Los Angeles","CA","90001","(555) 678-9012","https://fly2any.com","Travel agency","Especialistas na comunidade brasileira da Costa Oeste. Atendimento trilíngue com foco em voos Pacífico e conexões via Los Angeles. Consultas virtuais disponíveis. Conhecimento especializado em imigração e turismo brasileiro na região.","8:00 AM - 9:00 PM","8:00 AM - 9:00 PM","8:00 AM - 9:00 PM","8:00 AM - 9:00 PM","8:00 AM - 9:00 PM","9:00 AM - 7:00 PM","9:00 AM - 7:00 PM","Los Angeles, Beverly Hills, Santa Monica, Long Beach, Pasadena, Glendale, Burbank, Torrance, Inglewood, El Segundo","Service Area Business","Yes","Brazilian Travel, Portuguese Service, Virtual Consultation","FLY2ANY_LAX","Primeira consulta gratuita. Especialistas em voos Costa Oeste-Brasil.","Credit Card, PayPal, Pix, Bank Transfer"